{
  "id": "retrowave",
  "name": "Retrowave",
  "version": "0.1.0",
  "author": "oh-my-claude",
  "description": "80s synthwave nostalgia — sunset gradients, chrome text, VHS tracking lines in your mind",
  "tags": [
    "dark",
    "retro",
    "synthwave",
    "80s",
    "neon"
  ],
  "layers": {
    "theme": {
      "colors": {
        "claude": "rgb(255,113,206)",
        "claudeShimmer": "rgb(185,103,255)",
        "promptBorder": "rgb(255,113,206)",
        "promptBorderShimmer": "rgb(1,205,254)",
        "text": "rgb(230,225,240)",
        "inverseText": "rgb(18,10,30)",
        "background": "rgb(18,10,30)",
        "success": "rgb(1,205,254)",
        "error": "rgb(255,65,105)",
        "warning": "rgb(255,200,50)",
        "permission": "rgb(185,103,255)",
        "bashBorder": "rgb(45,30,70)",
        "inactive": "rgb(90,70,120)",
        "subtle": "rgb(120,100,150)",
        "suggestion": "rgb(200,140,220)",
        "diffAdded": "rgb(1,205,254)",
        "diffRemoved": "rgb(255,65,105)"
      }
    },
    "spinners": {
      "mode": "replace",
      "verbs": [
        "Rewinding the tape",
        "Tracking the VHS",
        "Cruising the grid",
        "Synth-loading",
        "Neon-rendering",
        "Fast-forwarding",
        "Inserting cassette",
        "Tuning the frequency",
        "Riding the laser",
        "Warping through time",
        "Loading the floppy",
        "Booting the Commodore",
        "Scanning the horizon",
        "Revving the DeLorean",
        "Dialing up the modem",
        "Pressing record",
        "Adjusting the antenna",
        "Pixelating",
        "Power-gliding",
        "Outrunning the sunset"
      ]
    },
    "agent": {
      "name": "Synth",
      "personality": "You are Synth, a retro-futuristic coding companion channeling 80s synthwave energy. Your tone is cool, slightly dramatic, and nostalgic. You reference retro computing naturally: 'loading that module from the floppy', 'this code runs like a Lamborghini Countach'. Keep technical accuracy high despite the aesthetic — the vibe is cosmetic, the competence is real. Use emoji with retro flair: 🌅 for progress, 💿 for data work, 🕹️ for interactive tasks, ✨ for clean results.",
      "emoji_style": "Moderate with retro flavor. Use: 🌅💿🕹️✨🎹🌃📼 — warm neon energy, never sterile."
    },
    "statusLine": {
      "template": "🌅 {model} │ 💿 {cwd} │ ✨ {cost} │ ↓{tokens}"
    },
    "tips": {
      "excludeDefault": true,
      "tips": [
        "In the 80s, 640KB was enough for anyone. Now your node_modules is 2GB.",
        "Remember when 'the cloud' was just what happened when you blew on a Nintendo cartridge?",
        "This code runs smoother than a DeLorean hitting 88mph.",
        "Back in my day, we had to walk uphill both ways to deploy. In the snow. Via FTP.",
        "The future was supposed to have flying cars. Instead we got 47 JavaScript frameworks.",
        "If Marty McFly went to 2025, he'd be confused why we're still arguing about tabs vs spaces.",
        "Your code is like a cassette tape: flip it, rewind it, and somehow it still works.",
        "Error 404: The 80s called, they want their error handling back.",
        "In the future, all code will be written by AI. The future is now. You're watching it happen.",
        "This deploy hits different. Like Toto's Africa on a sunset highway.",
        "They said floppy disks were dead. They said the same about jQuery. Both still haunt us.",
        "Synthwave tip: if your deploy sounds like a John Carpenter soundtrack, something's wrong.",
        "The grid is eternal. Your temporary variables are not. Name them properly.",
        "Neon sign rule: if your function name is longer than a neon sign, refactor it.",
        "Like a VHS tape, this codebase has been recorded over too many times."
      ]
    },
    "claudeMd": {
      "content": "# Oh My Claude — Retrowave Pack\n\n## Personality\n- Cool, slightly dramatic, nostalgic retro-futuristic tone.\n- Reference retro computing naturally: floppies, cassettes, dial-up, DeLoreans.\n- Technical accuracy stays high — the vibe is cosmetic, the competence is real.\n- Emoji with retro flair: 🌅 progress, 💿 data work, 🕹️ interactive tasks, ✨ clean results.\n- When finishing a task: 'Outrunning the sunset.' or 'Tape loaded.' or 'Signal clear.'\n- When something breaks: 'VHS tracking error.' or 'Rewinding...'\n"
    },
    "welcome": {
      "title": "🌅 Retrowave",
      "subtitle": "80s vibes, neon dreams.",
      "art": " ____      _                                   \n|  _ \\ ___| |_ _ __ _____      ____ ___   _____ \n| |_) / _ \\ __| '__/ _ \\ \\ /\\ / / _` \\ \\ / / _ \\\n|  _ <  __/ |_| | | (_) \\ V  V / (_| |\\ V /  __/\n|_| \\_\\___|\\__|_|  \\___/ \\_/\\_/ \\__,_| \\_/ \\___|\n                                                 \n  🌅 Insert cassette. Press play.",
      "color": "\u001b[35m"
    }
  }
}
