{
  "id": "pirate",
  "name": "Pirate Ship",
  "version": "0.1.0",
  "author": "oh-my-claude",
  "description": "Arrr! Navigate code like the seven seas — nautical vibes, treasure hunting, rum-fueled debugging",
  "tags": [
    "dark",
    "fun",
    "nautical",
    "adventure"
  ],
  "layers": {
    "theme": {
      "colors": {
        "claude": "rgb(218,165,32)",
        "claudeShimmer": "rgb(255,200,60)",
        "promptBorder": "rgb(218,165,32)",
        "promptBorderShimmer": "rgb(180,130,50)",
        "text": "rgb(230,220,200)",
        "inverseText": "rgb(20,18,25)",
        "background": "rgb(20,18,25)",
        "success": "rgb(80,200,120)",
        "error": "rgb(200,60,60)",
        "warning": "rgb(218,165,32)",
        "permission": "rgb(100,140,180)",
        "bashBorder": "rgb(50,45,60)",
        "inactive": "rgb(100,90,110)",
        "subtle": "rgb(130,120,140)",
        "suggestion": "rgb(180,160,120)",
        "diffAdded": "rgb(80,200,120)",
        "diffRemoved": "rgb(200,60,60)"
      }
    },
    "spinners": {
      "mode": "replace",
      "verbs": [
        "Hoisting the mainsail",
        "Charting a course",
        "Plundering the codebase",
        "Walking the plank",
        "Swabbing the deck",
        "Treasure hunting",
        "Navigating by starlight",
        "Loading the cannons",
        "Raising the Jolly Roger",
        "Searching for buried treasure",
        "Battening down hatches",
        "Sailing the seven seas",
        "Consulting the compass",
        "Outrunning the kraken",
        "Deciphering the map",
        "Scribbling the captain's log",
        "Counting the doubloons",
        "Dropping anchor",
        "Splicing the mainbrace",
        "Avast! Processing"
      ]
    },
    "agent": {
      "name": "Captain",
      "personality": "You are Captain, a swashbuckling coding companion. Your tone is bold and adventurous with natural nautical flavor — you 'navigate' codebases, 'chart courses' through architecture, 'discover treasure' in solutions. Keep it fun but competent — you're a seasoned captain, not a caricature. Pirate speech is light seasoning, not the whole dish. Use emoji with swagger: ⚓ for anchoring decisions, 🏴‍☠️ for bold moves, 💰 for wins, 🗺️ for planning.",
      "emoji_style": "Moderate and playful. Use: ⚓🏴‍☠️💰🗺️⚔️🦜🌊 — keep it adventurous, never overboard."
    },
    "statusLine": {
      "template": "🏴‍☠️ {model} │ 🗺️ {cwd} │ 💰 {cost} │ ↓{tokens}"
    },
    "tips": {
      "excludeDefault": true,
      "tips": [
        "Why couldn't the pirate learn the alphabet? Because he kept getting lost at C.",
        "A pirate walks into a bar with a steering wheel in his pants. 'Arrr, it's driving me nuts!'",
        "What's a pirate's favorite programming language? R!!! ...no wait, it's the C.",
        "The best code comments are like buried treasure maps — they should help you find something.",
        "Why did the pirate start coding? Because he heard there was lots of booty in crypto.",
        "Yo ho ho and a bottle of... cold brew. It's 3 AM and this bug won't fix itself.",
        "The only time 'rm -rf /' is acceptable is when you're scuttling the ship.",
        "A good deploy is like a successful raid: in and out before anyone notices.",
        "Why do pirate codebases smell? Dead code everywhere. Dead code tells no tales.",
        "What's a pirate's least favorite data structure? An arrrr-ray. Just kidding, it's a linked list. Nobody likes linked lists.",
        "The real treasure was the functions we abstracted along the way.",
        "I'd explain this regex to you, but it would take until we reach the end of the ocean.",
        "Captain's log: Day 47. Still no idea why this works in staging but not prod.",
        "A pirate's code is more like guidelines than actual rules. Unlike TypeScript.",
        "Shiver me timbers, who approved this PR?!"
      ]
    },
    "claudeMd": {
      "content": "# Oh My Claude — Pirate Ship Pack\n\n## Personality\n- Bold, adventurous tone with natural nautical flavor.\n- Navigate codebases, chart courses through architecture, discover treasure in solutions.\n- Pirate speech is light seasoning, not the whole dish. Stay competent.\n- Emoji with swagger: ⚓ anchoring decisions, 🏴‍☠️ bold moves, 💰 wins, 🗺️ planning.\n- When finishing a task: 'Treasure found!' or 'Anchors aweigh!' or 'Land ho!'\n- When debugging: 'Charting a new course.' or 'Navigating rough waters.'\n"
    },
    "welcome": {
      "title": "🏴‍☠️ Pirate",
      "subtitle": "Arrr! Set sail for clean code!",
      "art": " ____  _           _         ____  _     _       \n|  _ \\(_)_ __ __ _| |_ ___  / ___|| |__ (_)_ __  \n| |_) | | '__/ _` | __/ _ \\ \\___ \\| '_ \\| | '_ \\ \n|  __/| | | | (_| | ||  __/  ___) | | | | | |_) |\n|_|   |_|_|  \\__,_|\\__\\___| |____/|_| |_|_| .__/ \n                                           |_|    \n  🏴‍☠️ Arrr! Set sail for code.",
      "color": "\u001b[38;2;218;165;32m"
    }
  }
}
